{
  "version": "1.0.0",
  "lastUpdated": "2026-09-30",
  "steps": {
    "WELCOME": {
      "title": "Welcome to LogisX",
      "body": "Hi! I'm your guided assistant. I'll walk you through becoming a LogisX truck investor in about 10 minutes. There are 3 steps: your application, your trucks and documents, then your banking. You can pause while this tab stays open — your progress is kept, except your EIN/SSN, bank numbers and signatures, which are never saved.",
      "target": ".invest-page",
      "action": "info",
      "highlight": "none",
      "next": "OVERVIEW",
      "canSkip": true,
      "faqLinks": ["what_is_logisx", "how_long_does_this_take"],
      "parentStep": 0
    },
    "OVERVIEW": {
      "title": "3 steps, 3 sections",
      "body": "On the left you'll see 3 steps: Application, Fleet & Documents, and Banking. You're on Step 1 right now. Let's fill it out together — I'll highlight each field as we go.",
      "target": "[data-wizard-target='sidebar-steps']",
      "action": "info",
      "highlight": "spotlight",
      "next": "LEGAL_BASICS",
      "canSkip": true,
      "parentStep": 0
    },
    "LEGAL_BASICS": {
      "title": "Your legal name",
      "body": "Use the exact name on your ID or business filing. If you're applying as an individual, use your full name (First Last). If you're applying as a company, use the full legal entity name.",
      "target": "[data-wizard-target='legal-name']",
      "action": "input",
      "highlight": "spotlight",
      "next": "DBA_OPTIONAL",
      "examples": ["John Smith", "Doe Enterprises LLC"],
      "faqLinks": ["individual_vs_entity"],
      "parentStep": 0
    },
    "DBA_OPTIONAL": {
      "title": "Doing Business As (DBA)",
      "body": "If you operate under a different name than your legal name — like a trade name — enter it here. If not, you can leave this blank.",
      "target": "[data-wizard-target='dba']",
      "action": "input",
      "highlight": "spotlight",
      "next": "ENTITY_TYPE",
      "canSkip": true,
      "faqLinks": ["what_if_no_dba"],
      "parentStep": 0
    },
    "ENTITY_TYPE": {
      "title": "What type of business?",
      "body": "Pick the legal structure of your business. LLC and Corp are for registered companies. Sole Prop is for individual owners with no formal entity. If you're unsure, pick the one that matches what your accountant files.",
      "target": "[data-wizard-target='entity-type']",
      "action": "select",
      "highlight": "spotlight",
      "next": "ADDRESS_HELP",
      "faqLinks": ["ein_vs_ssn"],
      "parentStep": 0
    },
    "ADDRESS_HELP": {
      "title": "Principal business address",
      "body": "This is your main business or home address. Start typing and we'll suggest matches from Google Maps. You can also click the pin icon to drop a marker on a map, or the target icon to use your current location.",
      "target": "[data-wizard-target='address']",
      "action": "input",
      "highlight": "spotlight",
      "next": "CONTACT_INFO",
      "faqLinks": ["why_address"],
      "parentStep": 0
    },
    "CONTACT_INFO": {
      "title": "How we'll reach you",
      "body": "Enter a phone number and email we can use to contact you about your application. We'll send a confirmation to the email once you submit, and login credentials once you're approved.",
      "target": "[data-wizard-target='phone']",
      "action": "input",
      "highlight": "spotlight",
      "next": "EIN_OR_SSN",
      "faqLinks": ["when_will_i_hear_back"],
      "parentStep": 0
    },
    "EIN_OR_SSN": {
      "title": "EIN or SSN",
      "body": "We need a tax ID to report your earnings. If you're an LLC or Corp, enter your EIN (Employer Identification Number). If you're a sole proprietor or individual, your SSN is fine. Format: 9 digits, with or without dashes.",
      "target": "[data-wizard-target='ein-ssn']",
      "action": "input",
      "highlight": "spotlight",
      "next": "STEP0_REVIEW",
      "examples": ["12-3456789", "123-45-6789"],
      "faqLinks": ["ein_vs_ssn", "is_my_data_safe"],
      "parentStep": 0
    },
    "STEP0_REVIEW": {
      "title": "Ready to continue?",
      "body": "Nice work — that's Step 1 done. Click Continue at the bottom to move on to your fleet and documents. If the button is grey, you've missed a required field (legal name, address, phone, email, or EIN/SSN), or the email address isn't valid.",
      "target": "[data-wizard-target='continue-step0']",
      "action": "click",
      "highlight": "pulse",
      "next": "FLEET_INTRO",
      "faqLinks": ["continue_grey"],
      "parentStep": 0
    },
    "FLEET_INTRO": {
      "title": "Now let's add your trucks",
      "body": "Step 2 has two parts: tell us about your trucks, then sign three documents. Start by entering how many trucks you're adding. You can add between 1 and 20.",
      "target": "[data-wizard-target='fleet-size']",
      "action": "input",
      "highlight": "spotlight",
      "next": "VEHICLE_MAKE",
      "faqLinks": ["do_i_need_to_own", "add_more_later"],
      "parentStep": 1
    },
    "VEHICLE_MAKE": {
      "title": "Truck details: Make",
      "body": "For each truck, pick the manufacturer from the dropdown. We support all major brands: Freightliner, Kenworth, Peterbilt, Volvo, International, Mack, and more.",
      "target": "[data-wizard-target='vehicle-make']",
      "action": "select",
      "highlight": "spotlight",
      "next": "VEHICLE_MODEL",
      "parentStep": 1
    },
    "VEHICLE_MODEL": {
      "title": "Truck details: Model",
      "body": "Pick the model. The options update based on the make you just selected. If your exact model isn't listed, pick the closest match — we can confirm later.",
      "target": "[data-wizard-target='vehicle-model']",
      "action": "select",
      "highlight": "spotlight",
      "next": "VEHICLE_YEAR",
      "parentStep": 1
    },
    "VEHICLE_YEAR": {
      "title": "Truck details: Year",
      "body": "Enter the model year. This is on the vehicle title or registration.",
      "target": "[data-wizard-target='vehicle-year']",
      "action": "input",
      "highlight": "spotlight",
      "next": "VEHICLE_VIN",
      "parentStep": 1
    },
    "VEHICLE_VIN": {
      "title": "Truck details: VIN",
      "body": "The VIN is a 17-character code unique to your truck. You can find it on the dashboard, the driver-side door frame, the engine block, or your registration and insurance documents.",
      "target": "[data-wizard-target='vehicle-vin']",
      "action": "input",
      "highlight": "spotlight",
      "next": "DOCS_INTRO",
      "faqLinks": ["where_find_vin"],
      "parentStep": 1
    },
    "DOCS_INTRO": {
      "title": "Time to sign 3 documents",
      "body": "You need to sign all 3 documents before we can submit your application. Click any card to open it. Inside, you'll see the full document, type your name, draw your signature, and click Sign. Start with the Master Agreement.",
      "target": "[data-wizard-target='docs-list']",
      "action": "info",
      "highlight": "spotlight",
      "next": "MASTER_AGREEMENT_OPEN",
      "faqLinks": ["what_am_i_signing", "legally_binding"],
      "parentStep": 1
    },
    "MASTER_AGREEMENT_OPEN": {
      "title": "Open the Master Agreement",
      "body": "Click the Master Participation & Management Agreement card. This document describes how LogisX manages your trucks and how you get paid.",
      "target": "[data-wizard-target='doc-master_agreement']",
      "action": "click",
      "highlight": "pulse",
      "next": "VEHICLE_LEASE_OPEN",
      "parentStep": 1
    },
    "VEHICLE_LEASE_OPEN": {
      "title": "Next: Vehicle Lease",
      "body": "Now click the Commercial Vehicle Lease Agreement card. This is the lease that puts your trucks under the LogisX operating authority.",
      "target": "[data-wizard-target='doc-vehicle_lease']",
      "action": "click",
      "highlight": "pulse",
      "next": "W9_OPEN",
      "parentStep": 1
    },
    "W9_OPEN": {
      "title": "Last: W-9 tax form",
      "body": "Finally, click the W-9 Tax Form. This is the standard IRS form we need to report your earnings. We pre-fill most of it from what you entered earlier.",
      "target": "[data-wizard-target='doc-w9']",
      "action": "click",
      "highlight": "pulse",
      "next": "STEP1_REVIEW",
      "parentStep": 1
    },
    "STEP1_REVIEW": {
      "title": "Ready for Step 3?",
      "body": "You've added your fleet and signed all 3 documents. Click Continue to move on to your banking info. If the button is still grey, check that every truck has a year, make, model, and VIN, and that all 3 documents show as signed.",
      "target": "[data-wizard-target='continue-step1']",
      "action": "click",
      "highlight": "pulse",
      "next": "BANKING_INTRO",
      "parentStep": 1
    },
    "BANKING_INTRO": {
      "title": "Your payout account",
      "body": "We pay investors via ACH direct deposit, usually Net-60 from the load delivery date. Enter the bank where you want your payouts sent. Your info is sent over an encrypted connection and stored securely.",
      "target": "[data-wizard-target='banking-section']",
      "action": "info",
      "highlight": "spotlight",
      "next": "BANK_NAME",
      "faqLinks": ["is_banking_secure", "how_often_paid"],
      "parentStep": 2
    },
    "BANK_NAME": {
      "title": "Your bank",
      "body": "Start typing your bank's name. We'll autocomplete from a list of major US banks. If your bank isn't on the list, keep typing — we'll still accept it.",
      "target": "[data-wizard-target='bank-name']",
      "action": "input",
      "highlight": "spotlight",
      "next": "ROUTING_NUMBER",
      "parentStep": 2
    },
    "ROUTING_NUMBER": {
      "title": "Routing number",
      "body": "Your 9-digit bank routing number is on the bottom-left of your check, or in your bank's online banking under account details. All US banks have unique routing numbers.",